{"$schema":"https://json-schema.org/draft/2020-12/schema","$id":"https://axignal.com/schemas/infrastructure-project-pursuit-workspace-runtime.schema.json","title":"AXIGNAL Infrastructure Library and Project Pursuit Workspace Runtime","type":"object","additionalProperties":false,"required":["schema_version","task_id","programme_version","status","canonical_activation_authorised","dependency_status","trust_principles","infrastructure_library_binding","domain_modules","infrastructure_project_lifecycle","operating_pipeline","stage_evidence_classes","permit_land_types","financing_value_types","risk_classes","readiness_gates","external_action_types","required_approvals","project_outcome_states","languages","critical_dimensions","source_catalogue_contract","authority_model","rights_dimensions","observability","acceptance_gate"],"properties":{"schema_version":{"const":"axignal.infrastructure-project-pursuit-workspace-runtime/v0.1"},"task_id":{"const":"AX-GE2E-P11-T01"},"programme_version":{"const":"1.4.0"},"status":{"const":"DRAFT_ENGINEERING_FOUNDATION"},"canonical_activation_authorised":{"const":false},"dependency_status":{"type":"object","additionalProperties":false,"required":["normative_dependency_task","p07_engineering_head","p07_engineering_evidence_ready","p07_canonical_activation_authorised","engineering_base_task","p10_engineering_head","p10_engineering_evidence_ready","p10_canonical_activation_authorised","p09_canonical_activation_authorised","p08_canonical_activation_authorised","p06_canonical_activation_authorised","p05_canonical_activation_authorised","p04_canonical_activation_authorised","p03_canonical_activation_authorised","p02_canonical_activation_authorised","p01_dependency_satisfied","stacked_base_branch","merge_to_main_allowed"],"properties":{"normative_dependency_task":{"const":"AX-GE2E-P07-T01"},"p07_engineering_head":{"const":"e30f800cb284f1381c28c4ccbc116a8da4a9fe92"},"p07_engineering_evidence_ready":{"const":true},"p07_canonical_activation_authorised":{"const":false},"engineering_base_task":{"const":"AX-GE2E-P10-T01"},"p10_engineering_head":{"const":"563acd353ba3a90d253d582b7c19f1554fd011b1"},"p10_engineering_evidence_ready":{"const":true},"p10_canonical_activation_authorised":{"const":false},"p09_canonical_activation_authorised":{"const":false},"p08_canonical_activation_authorised":{"const":false},"p06_canonical_activation_authorised":{"const":false},"p05_canonical_activation_authorised":{"const":false},"p04_canonical_activation_authorised":{"const":false},"p03_canonical_activation_authorised":{"const":false},"p02_canonical_activation_authorised":{"const":false},"p01_dependency_satisfied":{"const":false},"stacked_base_branch":{"const":"agent/ax-ge2e-p10-regulatory-market-entry-workspace-v1.4"},"merge_to_main_allowed":{"const":false}}},"trust_principles":{"type":"array","minItems":16,"maxItems":16,"uniqueItems":true,"items":{"type":"string"}},"infrastructure_library_binding":{"type":"object","required":["library_id","workspace_type","canonical_name","entities","predicates","events","taxonomy_refs"],"properties":{"library_id":{"const":"AX-LIB-O04"},"workspace_type":{"const":"Project Pursuit Workspace"},"canonical_name":{"const":"Infrastructure and Capital Projects"},"entities":{"type":"array","minItems":6,"maxItems":6,"uniqueItems":true},"predicates":{"type":"array","minItems":6,"maxItems":6,"uniqueItems":true},"events":{"type":"array","minItems":5,"maxItems":5,"uniqueItems":true},"taxonomy_refs":{"type":"array","minItems":3,"maxItems":3,"uniqueItems":true}}},"domain_modules":{"type":"array","minItems":8,"maxItems":8,"items":{"type":"object","additionalProperties":false,"required":["module_id","service_id","record_types","invariants"],"properties":{"module_id":{"enum":["PROJECT_REGISTRY","SPONSOR_STAKEHOLDER","ASSET_SCOPE_LOCATION","PERMIT_LAND_ENVIRONMENT","FINANCING_COMMERCIAL","PROJECT_PURSUIT_WORKSPACE","DELIVERY_MILESTONE_RISK","EXTERNAL_ACTION_OUTCOME"]},"service_id":{"type":"string"},"record_types":{"type":"array","minItems":4,"maxItems":4,"uniqueItems":true},"invariants":{"type":"array","minItems":6,"maxItems":6,"uniqueItems":true}}}},"infrastructure_project_lifecycle":{"type":"object","required":["states","allowed_transitions","terminal_states","rules"],"properties":{"states":{"type":"array","minItems":12,"maxItems":12,"uniqueItems":true},"allowed_transitions":{"type":"array","minItems":20,"uniqueItems":true},"terminal_states":{"type":"array","minItems":1,"maxItems":2,"uniqueItems":true},"rules":{"type":"array","minItems":8,"maxItems":8,"uniqueItems":true}}},"operating_pipeline":{"type":"object","required":["stages","default_decision","indeterminate_as"],"properties":{"stages":{"type":"array","minItems":11,"maxItems":11},"default_decision":{"const":"DENY"},"indeterminate_as":{"const":"DENY"}}},"stage_evidence_classes":{"type":"array","minItems":10,"maxItems":10,"uniqueItems":true},"permit_land_types":{"type":"array","minItems":10,"maxItems":10,"uniqueItems":true},"financing_value_types":{"type":"array","minItems":10,"maxItems":10,"uniqueItems":true},"risk_classes":{"type":"array","minItems":10,"maxItems":10,"uniqueItems":true},"readiness_gates":{"type":"array","minItems":12,"maxItems":12,"uniqueItems":true},"external_action_types":{"type":"array","minItems":8,"maxItems":8,"uniqueItems":true},"required_approvals":{"type":"array","minItems":6,"maxItems":6,"uniqueItems":true},"project_outcome_states":{"type":"array","minItems":13,"maxItems":13,"uniqueItems":true},"languages":{"type":"array","minItems":6,"maxItems":6,"uniqueItems":true},"critical_dimensions":{"type":"array","minItems":10,"maxItems":10,"uniqueItems":true},"source_catalogue_contract":{"type":"object","required":["k","status","source_count","all_sources_product_admitted","all_rights_reviewed","public_coverage_authorised"],"properties":{"k":{"const":"AX-INFRA-SOURCE-CATALOGUE-001"},"status":{"const":"RESEARCH_CATALOGUE_NOT_PRODUCT_AVAILABILITY"},"source_count":{"const":6},"all_sources_product_admitted":{"const":false},"all_rights_reviewed":{"const":false},"public_coverage_authorised":{"const":false}}},"authority_model":{"type":"object","required":["actors","forbidden_actions","least_authority_rule","rules"],"properties":{"actors":{"type":"object","minProperties":13},"forbidden_actions":{"type":"array","minItems":12,"maxItems":12,"uniqueItems":true},"least_authority_rule":{"const":true},"rules":{"type":"array","minItems":8,"maxItems":8,"uniqueItems":true}}},"rights_dimensions":{"type":"array","minItems":10,"maxItems":10,"uniqueItems":true},"observability":{"type":"object","required":["metrics","alerts"],"properties":{"metrics":{"type":"array","minItems":17,"maxItems":17,"uniqueItems":true},"alerts":{"type":"array","minItems":17,"maxItems":17,"uniqueItems":true}}},"acceptance_gate":{"type":"object","required":["required_before_canonical_activation","current_decision"],"properties":{"required_before_canonical_activation":{"type":"array","minItems":28,"maxItems":28,"uniqueItems":true},"current_decision":{"const":"NOT_READY_FOR_CANONICAL_ACTIVATION"}}}}}