{"schema_version":"axignal.infrastructure-project-pursuit-workspace-runtime/v0.1","task_id":"AX-GE2E-P11-T01","programme_version":"1.4.0","status":"DRAFT_ENGINEERING_FOUNDATION","canonical_activation_authorised":false,"dependency_status":{"normative_dependency_task":"AX-GE2E-P07-T01","p07_engineering_head":"e30f800cb284f1381c28c4ccbc116a8da4a9fe92","p07_engineering_evidence_ready":true,"p07_canonical_activation_authorised":false,"engineering_base_task":"AX-GE2E-P10-T01","p10_engineering_head":"563acd353ba3a90d253d582b7c19f1554fd011b1","p10_engineering_evidence_ready":true,"p10_canonical_activation_authorised":false,"p09_canonical_activation_authorised":false,"p08_canonical_activation_authorised":false,"p06_canonical_activation_authorised":false,"p05_canonical_activation_authorised":false,"p04_canonical_activation_authorised":false,"p03_canonical_activation_authorised":false,"p02_canonical_activation_authorised":false,"p01_dependency_satisfied":false,"stacked_base_branch":"agent/ax-ge2e-p10-regulatory-market-entry-workspace-v1.4","merge_to_main_allowed":false},"trust_principles":["PROJECT_NE_ASSET","PROJECT_NE_PACKAGE","PACKAGE_NE_CONTRACT","ANNOUNCEMENT_NE_APPROVAL","APPROVAL_NE_FINANCING","FINANCING_APPROVAL_NE_COMMITMENT","COMMITMENT_NE_FINANCIAL_CLOSE","PERMIT_APPLICATION_NE_GRANT","LAND_IDENTIFIED_NE_SECURED","TENDER_EXPECTED_NE_NOTICE","READY_NE_EXTERNAL_AUTHORITY","AWARD_NE_SIGNED_CONTRACT","CONTRACT_NE_CONSTRUCTION_START","START_NE_COMPLETION","REACHABLE_NE_ADMITTED","MODEL_WORKER_NO_COMMITMENT"],"infrastructure_library_binding":{"library_id":"AX-LIB-O04","workspace_type":"Project Pursuit Workspace","canonical_name":"Infrastructure and Capital Projects","entities":["InfrastructureOpportunity","Project","Asset","Sponsor","Contractor","FinancingPackage"],"predicates":["SPONSORED_BY","DELIVERED_BY","FINANCED_BY","REQUIRES_PERMIT","HAS_MILESTONE","LOCATED_IN"],"events":["PROJECT_ANNOUNCED","FINANCING_APPROVED","PERMIT_GRANTED","TENDER_EXPECTED","CONSTRUCTION_STARTED"],"taxonomy_refs":["NUTS","CPV","CPC"]},"domain_modules":[{"module_id":"PROJECT_REGISTRY","service_id":"infrastructure_project_registry","record_types":["InfrastructureOpportunity","Project","ProjectVersion","ProjectAnnouncement"],"invariants":["PROJECT_REGISTRY_INV_01","PROJECT_REGISTRY_INV_02","PROJECT_REGISTRY_INV_03","PROJECT_REGISTRY_INV_04","PROJECT_REGISTRY_INV_05","PROJECT_REGISTRY_INV_06"]},{"module_id":"SPONSOR_STAKEHOLDER","service_id":"infrastructure_stakeholder_service","record_types":["Sponsor","ProjectOwner","DeliveryAuthority","ProjectStakeholder"],"invariants":["SPONSOR_STAKEHOLDER_INV_01","SPONSOR_STAKEHOLDER_INV_02","SPONSOR_STAKEHOLDER_INV_03","SPONSOR_STAKEHOLDER_INV_04","SPONSOR_STAKEHOLDER_INV_05","SPONSOR_STAKEHOLDER_INV_06"]},{"module_id":"ASSET_SCOPE_LOCATION","service_id":"infrastructure_asset_scope_service","record_types":["Asset","ProjectSite","ProjectCorridor","DeliveryPackage"],"invariants":["ASSET_SCOPE_LOCATION_INV_01","ASSET_SCOPE_LOCATION_INV_02","ASSET_SCOPE_LOCATION_INV_03","ASSET_SCOPE_LOCATION_INV_04","ASSET_SCOPE_LOCATION_INV_05","ASSET_SCOPE_LOCATION_INV_06"]},{"module_id":"PERMIT_LAND_ENVIRONMENT","service_id":"infrastructure_permit_land_service","record_types":["PermitRequirement","LandRight","EnvironmentalApproval","UtilityConnection"],"invariants":["PERMIT_LAND_ENVIRONMENT_INV_01","PERMIT_LAND_ENVIRONMENT_INV_02","PERMIT_LAND_ENVIRONMENT_INV_03","PERMIT_LAND_ENVIRONMENT_INV_04","PERMIT_LAND_ENVIRONMENT_INV_05","PERMIT_LAND_ENVIRONMENT_INV_06"]},{"module_id":"FINANCING_COMMERCIAL","service_id":"infrastructure_financing_service","record_types":["FinancingPackage","FundingCommitment","ProjectCostEstimate","RevenueModel"],"invariants":["FINANCING_COMMERCIAL_INV_01","FINANCING_COMMERCIAL_INV_02","FINANCING_COMMERCIAL_INV_03","FINANCING_COMMERCIAL_INV_04","FINANCING_COMMERCIAL_INV_05","FINANCING_COMMERCIAL_INV_06"]},{"module_id":"PROJECT_PURSUIT_WORKSPACE","service_id":"project_pursuit_workspace_service","record_types":["ProjectPursuitWorkspace","PursuitStrategy","CaptureTeam","PursuitWorkPackage"],"invariants":["PROJECT_PURSUIT_WORKSPACE_INV_01","PROJECT_PURSUIT_WORKSPACE_INV_02","PROJECT_PURSUIT_WORKSPACE_INV_03","PROJECT_PURSUIT_WORKSPACE_INV_04","PROJECT_PURSUIT_WORKSPACE_INV_05","PROJECT_PURSUIT_WORKSPACE_INV_06"]},{"module_id":"DELIVERY_MILESTONE_RISK","service_id":"infrastructure_delivery_risk_service","record_types":["ProjectMilestone","ProjectDependency","ProjectRisk","MitigationAction"],"invariants":["DELIVERY_MILESTONE_RISK_INV_01","DELIVERY_MILESTONE_RISK_INV_02","DELIVERY_MILESTONE_RISK_INV_03","DELIVERY_MILESTONE_RISK_INV_04","DELIVERY_MILESTONE_RISK_INV_05","DELIVERY_MILESTONE_RISK_INV_06"]},{"module_id":"EXTERNAL_ACTION_OUTCOME","service_id":"infrastructure_external_action_service","record_types":["ExternalEngagementPackage","ExternalActionReceipt","InfrastructureContract","ProjectOutcome"],"invariants":["EXTERNAL_ACTION_OUTCOME_INV_01","EXTERNAL_ACTION_OUTCOME_INV_02","EXTERNAL_ACTION_OUTCOME_INV_03","EXTERNAL_ACTION_OUTCOME_INV_04","EXTERNAL_ACTION_OUTCOME_INV_05","EXTERNAL_ACTION_OUTCOME_INV_06"]}],"infrastructure_project_lifecycle":{"states":["DISCOVERED","ANNOUNCED","CONCEPT","FEASIBILITY","APPRAISAL","FINANCING_PENDING","FINANCING_COMMITTED","PERMITTING_AND_LAND","PROCUREMENT_EXPECTED","PURSUIT_ACTIVE","CONTRACTED_OR_IN_DELIVERY","CLOSED"],"allowed_transitions":["DISCOVERED->ANNOUNCED","DISCOVERED->CLOSED","ANNOUNCED->CONCEPT","ANNOUNCED->FEASIBILITY","ANNOUNCED->CLOSED","CONCEPT->FEASIBILITY","CONCEPT->CLOSED","FEASIBILITY->APPRAISAL","FEASIBILITY->FINANCING_PENDING","FEASIBILITY->CLOSED","APPRAISAL->FINANCING_PENDING","APPRAISAL->PERMITTING_AND_LAND","APPRAISAL->CLOSED","FINANCING_PENDING->FINANCING_COMMITTED","FINANCING_PENDING->CLOSED","FINANCING_COMMITTED->PERMITTING_AND_LAND","FINANCING_COMMITTED->PROCUREMENT_EXPECTED","FINANCING_COMMITTED->CLOSED","PERMITTING_AND_LAND->PROCUREMENT_EXPECTED","PERMITTING_AND_LAND->CLOSED","PROCUREMENT_EXPECTED->PURSUIT_ACTIVE","PROCUREMENT_EXPECTED->CLOSED","PURSUIT_ACTIVE->CONTRACTED_OR_IN_DELIVERY","PURSUIT_ACTIVE->CLOSED","CONTRACTED_OR_IN_DELIVERY->CLOSED"],"terminal_states":["CLOSED"],"rules":["Unlisted transitions are denied.","Every transition binds the exact project version and evidence set.","Announcement cannot transition directly to financing committed or contracted.","Financing, permits, land and procurement paths are evaluated independently.","Cancellation, suspension or withdrawal transitions to CLOSED without erasing history.","Re-entry requires a superseding project version and new P07 decision.","Lifecycle state does not imply legal, financial or procurement certainty.","Observed project events remain distinct from forecasts and targets."]},"operating_pipeline":{"stages":[{"stage_id":"I01_DISCOVER","input":"CandidateInfrastructureSignal","output":"InfrastructureOpportunityCandidate","authority":"CANDIDATE_ONLY"},{"stage_id":"I02_NORMALIZE_PROJECT","input":"InfrastructureOpportunityCandidate","output":"VersionedProjectCandidate","authority":"CANDIDATE_ONLY"},{"stage_id":"I03_RESOLVE_STAKEHOLDERS","input":"VersionedProjectCandidate","output":"StakeholderCandidates","authority":"PROPOSAL_ONLY"},{"stage_id":"I04_MODEL_ASSET_SCOPE","input":"VersionedProjectCandidate","output":"AssetLocationPackageCandidates","authority":"CANDIDATE_ONLY"},{"stage_id":"I05_ASSESS_STAGE_FINANCE","input":"ProjectAndStakeholderCandidates","output":"StageAndFinancingAssessment","authority":"PROPOSAL_ONLY"},{"stage_id":"I06_ASSESS_PERMITS_LAND","input":"ProjectScopeCandidate","output":"PermitLandEnvironmentalAssessment","authority":"PROPOSAL_ONLY"},{"stage_id":"I07_OPEN_PROJECT_PURSUIT","input":"ApprovedPursueDecision","output":"ProjectPursuitWorkspace","authority":"HUMAN"},{"stage_id":"I08_PLAN_PURSUIT","input":"ProjectPursuitWorkspace","output":"PursuitPlanCandidates","authority":"CANDIDATE_ONLY"},{"stage_id":"I09_VALIDATE_READINESS","input":"PursuitPlanCandidates","output":"ProjectReadinessReport","authority":"DETERMINISTIC"},{"stage_id":"I10_HUMAN_EXTERNAL_ACTION","input":"ReadyExternalActionPackage","output":"ExternalActionRecord","authority":"HUMAN"},{"stage_id":"I11_RECORD_PROJECT_OUTCOME","input":"ObservedProjectOutcomeEvidence","output":"InfrastructureOutcomeRecord","authority":"HUMAN"}],"default_decision":"DENY","indeterminate_as":"DENY"},"stage_evidence_classes":["ANNOUNCEMENT","STRATEGIC_ALIGNMENT","CONCEPT","FEASIBILITY","APPRAISAL","FINANCING","PERMITTING","LAND_AND_RIGHTS","PROCUREMENT","DELIVERY"],"permit_land_types":["ENVIRONMENTAL_APPROVAL","PLANNING_PERMISSION","CONSTRUCTION_PERMIT","OPERATING_LICENCE","LAND_TITLE","LEASE","EASEMENT","RIGHT_OF_WAY","UTILITY_CONNECTION","COMMUNITY_OR_INDIGENOUS_CONSENT"],"financing_value_types":["PROJECT_COST","APPROVED_BUDGET","FINANCING_REQUEST","COMMITTED_DEBT","COMMITTED_EQUITY","GRANT_SUPPORT","GUARANTEE","VIABILITY_GAP","CONTRACT_VALUE","REALISED_SPEND"],"risk_classes":["SPONSOR","FINANCING","PERMITTING","LAND","ENVIRONMENTAL_SOCIAL","TECHNICAL","PROCUREMENT","SCHEDULE","COST","DEMAND_REVENUE"],"readiness_gates":["PROJECT_CURRENT","SPONSOR_AND_AUTHORITY_RESOLVED","STAGE_EVIDENCE_VERIFIED","ASSET_LOCATION_SCOPE_RESOLVED","FINANCING_STATUS_VERIFIED","PERMITS_AND_LAND_RESOLVED","PROCUREMENT_PATH_VERIFIED","DELIVERY_PACKAGES_DEFINED","RISKS_AND_DEPENDENCIES_REVIEWED","DOCUMENTS_AND_RIGHTS_CURRENT","APPROVALS_CURRENT","CHANNEL_AND_AUTHORITY_VERIFIED"],"external_action_types":["SPONSOR_ENGAGEMENT","NDA","PARTNERING_MOU","EXPRESSION_OF_INTEREST","PREQUALIFICATION","BID","INVESTMENT_COMMITMENT","CONTRACT_SIGNATURE"],"required_approvals":["PURSUE","BUDGET","RIGHTS","LEGAL","DOCUMENT","SUBMISSION_OR_ACTIVATION"],"project_outcome_states":["UNKNOWN","ANNOUNCED","APPROVED","FINANCED","FINANCIAL_CLOSE","TENDER_PUBLISHED","CONTRACT_AWARDED","CONTRACT_SIGNED","CONSTRUCTION_STARTED","OPERATIONAL","SUSPENDED","CANCELLED","COMPLETED"],"languages":["en","es","fr","de","pt","it"],"critical_dimensions":["project_stage","fi